{
  "schema": "flow.release-content/v1",
  "release_id": "flow-release-1.0-dark/v1",
  "git_binding": {
    "schema": "flow.release-content-git-binding/v1",
    "included_paths": [
      "CONTEXT.md",
      "README.md",
      "bin/flow",
      "config/flow/",
      "docs/adr/0007-use-drovr-as-the-delegated-agent-runtime.md",
      "docs/adr/0008-use-a-sole-run-authority-for-flow-lifecycle.md",
      "tests/flow_cli_test.sh",
      "tests/flow_transition_test.sh",
      "tools/drovr/HARNESS-INTERFACE.md",
      "tools/drovr/SPEC.md",
      "tools/drovr/package.json",
      "tools/drovr/src/",
      "tools/drovr/test/compatibility.test.mjs",
      "tools/drovr/test/description.test.mjs",
      "tools/flow/"
    ],
    "excluded_paths": [
      "config/flow/evidence/",
      "config/flow/node_modules/",
      "config/flow/transition-ledger.v1.json",
      "tools/flow/node_modules/"
    ],
    "candidate_tree_sha": "19e677217007e26444b940891b025a49ee935340",
    "qualification_base_commit": "a4a9a88a330be2b668339cf1a9b1b7c1b992564e"
  },
  "content_digest": "sha256:058497d5db4361eb86bbef2720196de338edbcea94e2b60087f623786a7a36c9",
  "files": [
    {
      "path": "README.md",
      "mode": "100644",
      "git_blob_sha": "271c7364aab5392825ee7b398025a6f451de6347",
      "sha256": "e116918b81bfb7347ebfefe18023e43ea2202dbb338df5b287b38e934b37240b"
    },
    {
      "path": "bin/flow",
      "mode": "100755",
      "git_blob_sha": "9c205c5f1aa7936f14840cfd0fcb6299e46678e0",
      "sha256": "41b22e9b517203f821cbc28f06bbdbb0a3525d517c625dc9bf617998d9b66a18"
    },
    {
      "path": "config/flow/README.md",
      "mode": "100644",
      "git_blob_sha": "46c05f0f3621f725d3402931c9278bb9e826ac7d",
      "sha256": "84a00713171639a61e149604d74408f20293b62bdbf5583502e7763ebe0d9a82"
    },
    {
      "path": "config/flow/contracts/catalog.v1.json",
      "mode": "100644",
      "git_blob_sha": "460ee4efc13f6976a888f6a758476be462989ec9",
      "sha256": "6bc7ba3cc966379b2943d79f05da733f1eaeec456ac705636de2554f4eae9b06"
    },
    {
      "path": "config/flow/contracts/drovr-required-features.v1.json",
      "mode": "100644",
      "git_blob_sha": "0098059acf2c84e265b00c569b8a043784fece61",
      "sha256": "837aca5ff5debd64e355dbc6ea0e19504a53fe85cc411adecbe0e643585b0896"
    },
    {
      "path": "config/flow/host/README.md",
      "mode": "100644",
      "git_blob_sha": "b18fba4a6621f0d9ff66e325833ed5a63d94590d",
      "sha256": "c259a9f55f3287a61f110dd2b3e8571ecdc1ee7aa61c9cb577208599b84fda2c"
    },
    {
      "path": "config/flow/host/flow-owner",
      "mode": "100755",
      "git_blob_sha": "85ba75bb1a349e21462f1defd7c042bdf908e004",
      "sha256": "cc9872ca20640715cf5b7d73a1ed005196d66ad311ba6a2a85ded569869de537"
    },
    {
      "path": "config/flow/host/macos/com.seavenly.flow-owner.plist",
      "mode": "100644",
      "git_blob_sha": "473055907009b11e7875e1f80171f9915bd9ca92",
      "sha256": "dc233adb3621ed0014cb731d66b6aba4d1693a7b3155589b06c3d02ead058179"
    },
    {
      "path": "config/flow/host/ubuntu/flow-owner.service",
      "mode": "100644",
      "git_blob_sha": "e86fa223162bbfb7714ddf408eb7b8d8483cac9d",
      "sha256": "cced2e6abd7556a53be9f4ff2b77cbd2dfde4948f9fecc766e88d54e5c13065c"
    },
    {
      "path": "config/flow/launch-policy.v1.json",
      "mode": "100644",
      "git_blob_sha": "d4b10047cf07e80c94eafe645a44c78c5dbcade4",
      "sha256": "dc138b56537c408f1e998f9dc0193097745ad789ad8ae0cc5bf2ddbbc121b113"
    },
    {
      "path": "config/flow/legacy-baselines.v1.json",
      "mode": "100644",
      "git_blob_sha": "9b5a62a6aece6b40d448b1ed2c73307763d64d77",
      "sha256": "cffa8d6b267a609ffef99d55aca51d773ee97986596a64bc9ad0591ede6b0fb3"
    },
    {
      "path": "config/flow/package-lock.json",
      "mode": "100644",
      "git_blob_sha": "a6579377b090e9d1d3bfc8abc9832980f83b4698",
      "sha256": "c7f514613403e7e172a798b1454adaec11a197016376a9edafbee7fedb153ce7"
    },
    {
      "path": "config/flow/package.json",
      "mode": "100644",
      "git_blob_sha": "e825476b17100ed7dcb2bf6321d3c71b245e6257",
      "sha256": "aa914af8ab33bbb218a2ee82ad4442361a075c03ada32375a4d7acad84fe8dfb"
    },
    {
      "path": "config/flow/qualification/README.md",
      "mode": "100644",
      "git_blob_sha": "2b757ab6baaa3e7db0b48d62045f0a32ea884977",
      "sha256": "08e64e766eb06948ce88ca22109c25e036b69e7a0b72625788d03d0413911ded"
    },
    {
      "path": "config/flow/qualification/host-recovery.v1.json",
      "mode": "100644",
      "git_blob_sha": "00331076996d6b3f8ee63528d2439ea9bef25e55",
      "sha256": "32a1053d299e794c07b6c0256eb02a27bd26ffe391dda6f8ff12665b658a6702"
    },
    {
      "path": "config/flow/release-manifest.v1.json",
      "mode": "100644",
      "git_blob_sha": "d6f509905b562dd6f7377e439e8aa6d83299f459",
      "sha256": "8b0b4bc7287f887d869cafef5cb61e41d385ceea733a1a41e585cff5471546d9"
    },
    {
      "path": "config/flow/schemas/flow.authority-critique-input-binding.v1.schema.json",
      "mode": "100644",
      "git_blob_sha": "e39920f5636f987215844cb2d5c45ac5f9956aad",
      "sha256": "e1be45e364eb675e622876f76adc65a10cee90e495af1b894f6d039e71f744b8"
    },
    {
      "path": "config/flow/schemas/flow.authority-fact.v1.schema.json",
      "mode": "100644",
      "git_blob_sha": "df5e83313947673aac2c2c817fba6294e1971b45",
      "sha256": "eab649f9f22dc3fd9216a5edb6bbc417979b0b41d9ef88dced875c44ae39e572"
    },
    {
      "path": "config/flow/schemas/flow.authority-observation.v1.schema.json",
      "mode": "100644",
      "git_blob_sha": "5ff42a7116fc0fa99ae6ebbf5a5bbe98d1611b76",
      "sha256": "36b4087bf2986741e41cb2b0ead203256aae6e3ee6b7537abafecfc9c0277a24"
    },
    {
      "path": "config/flow/schemas/flow.authority-schema-compatibility.v1.schema.json",
      "mode": "100644",
      "git_blob_sha": "98a8fa1877046203d1beb7cd7309984ae73a17bd",
      "sha256": "a3776f1be90e12db33abf2ca9e0dfe3397b96366380b240103126a26b79dbffc"
    },
    {
      "path": "config/flow/schemas/flow.authority-schema-transition-boundary.v1.schema.json",
      "mode": "100644",
      "git_blob_sha": "37d905888de897c270b944a287d4ab03db3c41af",
      "sha256": "40d62a93adb4a6573b48e0ba47d2b19178521fcec1127c07603e4013a0d180be"
    },
    {
      "path": "config/flow/schemas/flow.capability-manifest.v1.schema.json",
      "mode": "100644",
      "git_blob_sha": "364e9e0d31ef3395baf69e3f2bfd4b74be48116d",
      "sha256": "d39f53e01245143583e1dcb66e1a3d84cfc7f965166be63fff3f7b17d999a53a"
    },
    {
      "path": "config/flow/schemas/flow.dark-opt-in.v1.schema.json",
      "mode": "100644",
      "git_blob_sha": "0ad6fc7d0b98aa641be28db59f540fe650d6807d",
      "sha256": "d304fc3242168b2ba504b789be5d22323ae3b437ee1e868d18f18dfbce4a4c3b"
    },
    {
      "path": "config/flow/schemas/flow.delegate-execution-authority.v1.schema.json",
      "mode": "100644",
      "git_blob_sha": "34505d8dd9ab9aa7fa6e5a42ae955f5ec9303f46",
      "sha256": "edd4308420d3dd2e5a9afa86d1d918ca690a9d192381f709629ea453fb925d0c"
    },
    {
      "path": "config/flow/schemas/flow.delegate-execution-resource-reference.v1.schema.json",
      "mode": "100644",
      "git_blob_sha": "0292fdb9840fdf68c49f76944b0183df30cb7341",
      "sha256": "dcfa3e9cdc22ba8d5b1d09d628b2672375531773df8d8847a0ea13ead58394c5"
    },
    {
      "path": "config/flow/schemas/flow.delegate-execution-resource-selection.v1.schema.json",
      "mode": "100644",
      "git_blob_sha": "9f184e37d03e71165a311177a600ffcea93c8907",
      "sha256": "fb8ecba5e4c8fb3121d0ecc3abbdd0a60b01fdd6df3df6691ee3cc61ca2d72e4"
    },
    {
      "path": "config/flow/schemas/flow.delegate-failure-observation.v1.schema.json",
      "mode": "100644",
      "git_blob_sha": "a59c19bfbf373a7eb6c83f8fc2a89f385f219024",
      "sha256": "dc212a27021df3060ccbf68fd0229243201351fa39d39e485d7ebe28e4767c4b"
    },
    {
      "path": "config/flow/schemas/flow.delegate-input-envelope.v1.schema.json",
      "mode": "100644",
      "git_blob_sha": "e1efd2308b030f0b7e031235773078c230e43a2e",
      "sha256": "f2ea4c8373dd8c7edd034121dd079b0787d6581835fb31db44ac2ca3af1a604a"
    },
    {
      "path": "config/flow/schemas/flow.delegate-output-requirements.v1.schema.json",
      "mode": "100644",
      "git_blob_sha": "569eb1a42cb82e3a0d4ec60b5814b4f2da5a3aa7",
      "sha256": "2a95650dec5885d8eef23d95cb9b62b930f6e38b6e692a1b8fb25ba1764db110"
    },
    {
      "path": "config/flow/schemas/flow.delegate-predecessor-evidence.v1.schema.json",
      "mode": "100644",
      "git_blob_sha": "c430dcf6fbbc8e7301c5bfcc444172ab2ddf1f58",
      "sha256": "f46233e5d495cc3047f72e4992f2ba5c136d00bdb842ba02de9288d00c26c5b6"
    },
    {
      "path": "config/flow/schemas/flow.delegate-task-inputs.v1.schema.json",
      "mode": "100644",
      "git_blob_sha": "d9b220c4a6c0210d506b0443d8c63b74c7d71082",
      "sha256": "a9a0cf3d04dbdf84e5a5d5b65271fc0bd64ae9d8636099192a6f66796f864c19"
    },
    {
      "path": "config/flow/schemas/flow.delegated-agent-description-projection.v1.schema.json",
      "mode": "100644",
      "git_blob_sha": "b5e8c6f69b71b675802a8b261b956378960fd22c",
      "sha256": "0f022f1e562a32712555f8d0f820f6152978f7e355d4ac985e03dfa18df3db9b"
    },
    {
      "path": "config/flow/schemas/flow.delegated-agent-lifecycle-projection.v1.schema.json",
      "mode": "100644",
      "git_blob_sha": "f9d52645debc6f76e80865bef6fec46bced1b8e7",
      "sha256": "f82ce851679d3e8b7bc68fc2f99d84bd8a2089fda467573565d7f4dd500d9c6b"
    },
    {
      "path": "config/flow/schemas/flow.delegated-agent-resource-ensure-request.v1.schema.json",
      "mode": "100644",
      "git_blob_sha": "e01d86a9725cd5c2e14cd9e8525d04552237614e",
      "sha256": "620a21e551d3a4d98803f037f001526971aceb2541667ed2cef81a7c9167868a"
    },
    {
      "path": "config/flow/schemas/flow.delegated-agent-resource-projection.v1.schema.json",
      "mode": "100644",